{
  "$schema": "https://json-schema.org/draft/2020-12/schema",
  "$id": "board-profiles/board.schema.json",
  "title": "Board profile",
  "description": "Machine-readable board facts, plus the corroboration record that says why you should believe them. Data, never prose. The reason this file type exists: GPIO 7 is a panel power-enable on the CrowPanel 2.13 v1 and a battery-sense input on the Heltec E290, so a pin question is never answerable without a board ID - and a board ID is only worth having if the profile behind it is right.",
  "type": "object",
  "required": ["schema", "version", "id", "status", "family", "logic_v", "gpio_valid"],
  "properties": {
    "schema": { "const": "hardware-electronics/board" },
    "version": { "type": "string" },
    "id": { "type": "string", "pattern": "^[a-z0-9_.-]+$" },
    "display_name": { "type": "string" },
    "status": {
      "description": "draft = not yet corroborated; any design validated against it is warned. active = load-bearing groups meet their corroboration thresholds. superseded = retained for its historical pin facts only.",
      "enum": ["active", "superseded", "draft"]
    },
    "superseded_by": { "type": ["string", "null"] },
    "family": { "type": "string" },
    "mcu": {
      "type": "object",
      "properties": {
        "family": { "type": "string" },
        "cores": { "type": ["integer", "null"] },
        "flash_mb": { "type": ["number", "null"] },
        "flash_mb_provenance": { "type": "string" },
        "psram_mb": { "type": ["number", "null"] },
        "psram_note": { "type": "string" }
      }
    },
    "fqbn": { "type": ["string", "null"] },
    "fqbn_note": { "type": "string" },
    "logic_v": { "type": "number" },

    "gpio_valid": { "type": "array", "items": { "type": "integer" } },
    "input_only": { "type": "array", "items": { "type": "integer" } },
    "strapping": { "type": "object", "additionalProperties": { "type": "string" } },
    "rtc_capable": { "type": "array", "items": { "type": "integer" } },
    "adc1": { "type": "object", "additionalProperties": { "type": "string" } },
    "adc2": { "type": "object", "additionalProperties": { "type": "string" } },
    "usb": { "type": "array", "items": { "type": "integer" } },
    "jtag": { "type": "array", "items": { "type": "integer" } },

    "consumed": {
      "description": "pin -> why it is not yours to allocate.",
      "type": "object",
      "additionalProperties": { "type": "string" }
    },
    "free": {
      "description": "Authoritative free list when the vendor reference enumerates one. When present it OVERRIDES the derived list, because a pin can be unavailable for reasons no generic rule knows about. Blessing a pin here is the dangerous direction of error.",
      "type": ["array", "null"],
      "items": { "type": "integer" }
    },
    "conditional_free": { "type": "object", "additionalProperties": { "type": "string" } },
    "contradicted_header_pins": { "type": "object", "additionalProperties": { "type": "string" } },

    "onboard_i2c": {
      "type": "object",
      "properties": {
        "sda": { "type": "integer" },
        "scl": { "type": "integer" },
        "pullup_ohm": { "type": ["number", "null"] },
        "connector": { "type": "string" },
        "connector_provenance": { "type": "string" },
        "note": { "type": "string" },
        "devices": { "type": "array", "items": { "type": "object" } }
      }
    },

    "power": { "type": "object" },
    "radio": { "type": "object" },
    "display": { "type": "object" },
    "mechanical": { "type": "object" },

    "pin_notes": { "type": "object", "additionalProperties": { "type": "string" } },
    "notes": { "type": "array", "items": { "type": "string" } },
    "sources": {
      "description": "Free-text source list kept for readability. The machine-checkable version is corroboration.sources.",
      "type": "array",
      "items": { "type": "string" }
    },

    "corroboration": {
      "description": "Why you should believe this profile. See schemas/corroboration.schema.json.",
      "type": "object"
    },

    "accepted_findings": {
      "description": "Advisory profile_lint findings accepted on purpose, each with a written reason. Self-consistency errors and insufficient corroboration cannot be accepted.",
      "type": "object",
      "additionalProperties": { "type": "string", "minLength": 10 }
    }
  }
}
